Id,Title,Description,URL,Timestamp
1,"India government under fire over fuel prices, opposition unites for protests","Nationwide protests against record high petrol and diesel prices shut down businesses, government offices and schools in many parts of India on Monday, and in some places protesters blocked trains and roads and vandalized vehicles.",https://www.reuters.com/article/us-india-election-protests/india-government-under-fire-over-fuel-prices-opposition-unites-for-protests-idUSKCN1LQ0NH,2018-09-10T06:56:59Z
2,Hatred being spread in country under Modi#39;s rule: Rahul Gandhi,"Addressing a protest rally at Ramlila grounds here organised by the Congress and joined by other opposition parties over fuel price hike, Gandhi also questioned the silence of PM Modi on fuel prices and the Rafale fighter jet deal.",https://www.moneycontrol.com/news/politics/hatred-being-spread-in-country-under-modis-rule-rahul-gandhi-2935961.html,2018-09-10T06:56:05Z
3,"India govt under fire over fuel prices, opposition...","NEW DELHI, Sept 10 (Reuters) - Nationwide protests against  record high petrol and diesel prices shut down businesses,  government offices and schools in...",https://www.dailymail.co.uk/wires/reuters/article-6150197/India-govt-fire-fuel-prices-opposition-unites-protests.html,2018-09-10T06:54:37Z
4,Salvini appeso come Mussolini: il murales choc che indigna Torino,"Sergio Rame Il murales apparso su un muro a Torino. Salvini appeso a testa in giù come il Duce in piazzale Loreto. Ma la Lega: ""L'Italia è con lui"" Un altro murale choc indigna Torino e l'Italia intera. Sempre contro Matteo Salvini. Dopo i violenti graffiti c…",http://www.ilgiornale.it/news/politica/salvini-appeso-mussolini-murales-choc-che-indigna-torino-1573843.html,2018-09-10T06:51:14Z
5,We want to see opposition strength on raising public issues: Shiv Sena,The BJP#39;s bickering ally said it has been carrying the burden of opposition parties on its shoulders for long and it now wants to see where these outfits stand on pro-people issues.,https://www.moneycontrol.com/news/india/we-want-to-see-opposition-strength-on-raising-public-issues-shiv-sena-2935831.html,2018-09-10T06:50:05Z
6,"Decision On PDP Boycotting Polls Over 35A, Mehbooba Mufti Calls Meeting","Former chief minister of Jammu and Kashmir and PDP chief Mehbooba Mufti has called a meeting of her party leaders, to decide if they will boycott the urban local body polls and the panchayat elections later this year. The party has already indicated that it c…",https://www.ndtv.com/srinagar-news/pdp-chief-mehbooba-mufti-calls-meeting-to-decide-on-boycotting-panchayat-polls-in-jammu-and-kashmir-1914077,2018-09-10T06:47:10Z
7,Shed differences and unite to save this country: Manmohan tells Opposition,"Voices from across the country can be heard saying people are unhappy with the government, Singh said",https://www.business-standard.com/article/current-affairs/shed-differences-and-unite-to-save-this-country-manmohan-tells-opposition-118091000326_1.html,2018-09-10T06:40:00Z
8,"Bharat Bandh: Congress leaders Sanjay Nirupam, Ashok Chavan arrested in Mumbai after staging ‘rail-roko’ at Andheri station","Chavan and Nirupam led thousands of activists to stage a noisy protest outside the Andheri station bus depot, after which they got down on the railway tracks, shouting anti-government slogans. The duo have reportedly been taken to DN Nagar police station. The…",https://www.firstpost.com/india/bharat-bandh-congress-leaders-sanjay-nirupam-ashok-chavan-arrested-in-mumbai-after-staging-rail-roko-at-andheri-station-5151641.html,2018-09-10T06:36:47Z
9,We want to see opposition strength on raising public issues: Shiv Sena,"India News: MUMBAI: The Shiv Sena Monday took a jibe at opposition parties, stating their nationwide bandh against the rising fuel prices should not look like a s.",https://timesofindia.indiatimes.com/india/we-want-to-see-opposition-strength-on-raising-public-issues-shiv-sena/articleshow/65750702.cms,2018-09-10T06:36:35Z
10,Former PM Manmohan Singh hits out at Modi government,Leaders of various opposition parties led by Congress president Rahul Gandhi kickstarted Monday the country-wide protest against rising fuel prices from Rajghat as part of the 'Bharat Bandh' call given by the party.,https://economictimes.indiatimes.com/news/politics-and-nation/former-pm-manmohan-singh-hits-out-at-modi-government/articleshow/65750682.cms,2018-09-10T06:35:22Z
11,"Bharat Bandh: Congress Workers Protest In Maharashtra, Block Rail Traffic",The Maharashtra Congress Monday staged protests in various parts of the state in response to the Bharat Bandh called by the party's central leadership against rising fuel prices.,https://www.ndtv.com/india-news/bharat-bandh-congress-workers-protest-in-maharashtra-block-rail-traffic-1914067,2018-09-10T06:34:53Z
12,"Bharat Bandh LIVE updates: Rahul Gandhi slams Narendra Modi over price rise, says gas cylinder which cost Rs 400 is now Rs 800","Bharat Bandh LIVE updates: Slamming the ruling government over price hike, Rahul said, ""Gas Cylinder that used to cost Rs 400 is now Rs 800. Modiji said that what didn't happen in 70 years, we will do in 4 years. Wherever he goes, he just goes to sow division…",https://www.firstpost.com/india/bharat-bandh-live-updates-rahul-gandhi-slams-narendra-modi-over-price-rise-says-gas-cylinder-which-cost-rs-400-is-now-rs-800-5149371.html,2018-09-10T06:34:12Z
13,Congress workers stage protests in Maharashtra over rising fuel prices,"The shutdown is backed by other opposition parties such as the Nationalist Congress Party (NCP), the Raj Thackeray-led Maharashtra Navnirman Sena (MNS), the Samajwadi Party.",https://economictimes.indiatimes.com/news/politics-and-nation/congress-workers-stage-protests-in-maharashtra-over-rising-fuel-prices/articleshow/65750536.cms,2018-09-10T06:32:50Z
14,"#39;Bharat Bandh#39; an attempt to spread rumour, confusion: BJP","Union minister and Bharatiya Janata Party leader Mukhtar Abbas Naqvi took on the Congress, saying it has been a ""history-sheeter"" on the issue of price rise whenever it was in power and is now shedding crocodile tears.",https://www.moneycontrol.com/news/politics/bharat-bandh-an-attempt-to-spread-rumour-confusion-bjp-2935591.html,2018-09-10T06:32:05Z
15,Watch live coverage of Bharat Bandh on India Today TV and Aaj Tak,A Bharat Bandh protest is being held to protest the rising petrol and diesel prices in India. India Today TV and Aaj Tak are covering the September 10 Bharat Bandh protests non-stop. You can also watch live visuals of the Bharat Bandh on both India Today TV a…,https://www.indiatoday.in/india/story/live-streaming-bharat-bandh-fuel-price-protests-india-today-tv-aaj-tak-1336395-2018-09-10,2018-09-10T06:29:00Z
16,"BJP terms ‘Bharat Bandh’ an attempt to spread confusion, says people will ‘puncture the grand alliance balloon’","BJP leader Mukhtar Abbas Naqvi took on the Congress, saying it has been a ""history-sheeter"" on the issue of price rise whenever it was in power. The post BJP terms ‘Bharat Bandh’ an attempt to spread confusion, says people will ‘puncture the grand alliance ba…",https://www.firstpost.com/politics/bjp-terms-bharat-bandh-an-attempt-to-spread-confusion-says-people-will-puncture-the-grand-alliance-balloon-5151911.html,2018-09-10T06:26:57Z
17,Former PM Manmohan Singh hits out at Modi Government,Singh made these remarks at an opposition protest against rising fuel prices here.,https://www.moneycontrol.com/news/india/former-pm-manmohan-singh-hits-out-at-modi-government-2935521.html,2018-09-10T06:25:05Z
18,"Bannon in Italia per lanciare The Movement: ​""Salvini è un leader mondiale""","Per Steve Bannon l'Italia è ""il centro politico del mondo"", una sorta di laboratorio, come lo è stato l'America con Donald Trump e l'India con Nerendra Modi. In questi giorni quello, che è stato il consulente del presidente degli Stati Uniti nella vittoriosa …",http://www.ilgiornale.it/news/politica/bannon-italia-lanciare-movement-salvini-leader-mondiale-1573834.html,2018-09-10T06:22:42Z
19,"Jack Ma to retire in 2019: Here#39;s a look at succession, future plans and what it means for India",Maâs suggestion to his successor will be to focus on India that is not yet saturated like China.,https://www.moneycontrol.com/news/business/jack-ma-to-retire-in-2019-heres-a-look-at-succession-future-plans-and-what-it-means-for-india-2935501.html,2018-09-10T06:19:47Z
20,"Modi Government Has Crossed All Limits, Says Manmohan Singh At Bandh","Former prime minister Manmohan Singh, participating in the opposition's ""Bharat Bandh"" protest today, tore into the BJP-led government, saying it has ""now crossed all limits"".",https://www.ndtv.com/india-news/narendra-modi-government-has-crossed-all-limits-says-manmohan-singh-at-bharat-bandh-1914049,2018-09-10T06:17:20Z
21,Congress leader P. Chidambaram dares BJP to contradict official data on economy,P. Chidambaram reacted after BJP president Amit Shah asked his party leaders to challenge him and others from the opposition for an open debate on the government’s economic policies based on facts and figures,https://www.livemint.com/Politics/1wtVlJY7vVqhVgOQxzo0aM/Congress-leader-P-Chidambaram-dares-BJP-to-contradict-offic.html,2018-09-10T06:11:43Z
22,"Bharat Bandh LIVE updates: India is tired of Narendra Modi, says Rahul Gandhi, reiterates favours given to industrialists","Bharat Bandh LIVE updates: Leading the Congress march in New Delhi and spearheading the nationwide Bharat Bandh, Rahul Gandhi addressed the workers and slammed the Narendra Modi government for lacking empathy for the poor. Reiterating his point on BJP support…",https://www.firstpost.com/india/bharat-bandh-live-updates-india-is-tired-of-narendra-modi-says-rahul-gandhi-reiterates-favours-given-to-industrialists-5149371.html,2018-09-10T06:10:12Z
23,"'Bharat Bandh' an attempt to spread rumour, confusion: BJP",India News: NEW DELHI: The BJP Monday dubbed the 'Bharat Bandh' call given by the Congress and several other parties as an attempt to spread rumour and confusion .,https://timesofindia.indiatimes.com/india/bharat-bandh-an-attempt-to-spread-rumour-confusion-bjp/articleshow/65750201.cms,2018-09-10T06:01:50Z
24,"Bharat Bandh: Offices, schools and colleges open at regular time","Heavy police deployment was made in the national capital with reserve police forces deployed and motorcycle patrols being put on high alert, a senior police officer said.",https://economictimes.indiatimes.com/news/politics-and-nation/bharat-bandh-offices-schools-and-colleges-open-at-regular-time/articleshow/65750185.cms,2018-09-10T06:00:55Z
25,"Away From Politics, Indian Air Force Pilot Crew Flies To France For Rafale Jet Training","A fighter pilot, an engineer and four technicians form the first batch of the team that will train on the Rafale jets  as IAF  mulls to prepare itself  for the induction of  the first batch of the French fighter by September next year. The team left on Sunday…",https://www.indiatimes.com/news/india/away-from-politics-indian-air-force-pilot-crew-flies-to-france-for-rafale-jet-training-352764.html,2018-09-10T05:59:43Z
26,"'Bharat Bandh' An Attempt To Spread Rumour, Confusion Among Masses: BJP","The BJP Monday dubbed the 'Bharat Bandh' call given by the Congress and several other parties as an attempt to spread rumour and confusion among the masses and said people will ""puncture the grand alliance balloon"" floated by the main opposition party.",https://www.ndtv.com/india-news/bharat-bandh-an-attempt-to-spread-rumour-confusion-among-masses-bjp-1914037,2018-09-10T05:59:29Z
27,"Salvini ritratto a testa in giù a Torino, lui: “Che squallore, quanto odio. Rispondiamo con le idee”","«Salvini a testa in giù in centro a Torino. Che squallore. Quanto odio. Noi rispondiamo con idee, cuore e coraggio, so che siamo in tantissimi, vero?» Così il vicepremier e ministro dell’Interno Matteo Salvini, postando la foto di un murales con un uomo somig…",http://www.lastampa.it/2018/09/10/cronaca/salvini-ritratto-a-testa-in-gi-a-torino-lui-che-squallore-quanto-odio-rispondiamo-con-le-idee-guydooUBRgo8DTlWrY1QaJ/pagina.html,2018-09-10T05:57:52Z
28,"Despite President Trump’s hollering, US-India ties have actually thrived on his watch","For the first time, India will have a liaison person at the Bahrain naval base of Centcom, the first “dialogue” with a US command that has been traditionally closer to Pakistan",https://blogs.timesofindia.indiatimes.com/Globespotting/two-plus-two-tango-despite-president-trumps-hollering-us-india-ties-have-actually-thrived-on-his-watch/,2018-09-10T05:57:33Z
29,A New ERA of Transparency & Accountability in Real Estate – 2 Years of Implementation -Shri Hardeep Puri Inaugurates “First Regional Workshop on RERA,"The Union Minister of State(I/C) Housing and Urban Affairs, Shri Hardeep Singh Puri has said that the NDA government at the centre is committed to provide positive solution to the problems of home buyers, so that they get their home as soon as possible.",http://pib.nic.in/newsite/PrintRelease.aspx?relid=183353,2018-09-10T05:57:00Z
30,"Manmohan Singh: Modi govt has crossed limits, Opposition must band together","Former prime minister Manmohan Singh launched a blistering attack on the Naredra Modi government in New Delhi where he took part in the Congress-led nationwide protest over rising fuel prices. Singh, in a rare public speech, derided the Modi government for cr…",https://www.indiatoday.in/india/story/manmohan-singh-bharat-bandh-protest-narendra-modi-fuel-prices-1336345-2018-09-10,2018-09-10T05:52:00Z
31,Valve: sono le brutte persone a fare brutti videogiochi - Game Legends,Game Legends Valve: sono le brutte persone a fare brutti videogiochi Game Legends Valve ha deciso di prendere posizione contro i così detti Troll di Internet e adottare alcune misure per selezionare i giochi che sono pubblicati sul negozio di digital delivery…,https://www.gamelegends.it/275531/valve-sono-le-brutte-persone-a-fare-brutti-videogiochi/,2018-09-10T05:51:49Z
32,"सत्तांतर होणारच; मनमोहन, सोनियांचे धरणे","'पंतप्रधान नरेंद्र मोदी सर्वच आघाड्यांवर अपयशी ठरले आहेत. त्यामुळे सत्तांतर निश्चित असून विरोधकांनी सर्व मतभेद विसरून एकत्र यावं', असं आवाहन माजी पंतप्रधान मनमोहन सिंग यांनी केलं आहे. इंधन दरवाढीच्या विरोधात काँग्रेसने धरणं धरलं असून त्यात मनमोहन सिंग यांच्या…",https://maharashtratimes.indiatimes.com/india-news/sonia-gandhi-manmohan-singh-join-bharat-bandh-over-rising-fuel-prices/articleshow/65749998.cms,2018-09-10T05:51:42Z
33,Prashant Kishore not to campaign for anyone in 2019,"Interacting with students of ISB Hyderabad on Sunday night, Prashant Kishore said for last two years he wanted to leave this domain but wanted to leave his organisation Indian Political Action Committee (IPAC) in safe hands before taking the decision.",https://indianexpress.com/article/india/prashant-kishore-not-to-campaign-for-anyone-in-2019-5348200/,2018-09-10T05:41:14Z
34,"Bharat Bandh Live: Fuel prices hit record new high, rupee goes down to historic low - Janta Ka Reporter 3.0",21 opposition parties joined together in support of the Bharat Bandh to protest against the rise in fuel prices and depreciation of the Indian rupee,http://www.jantakareporter.com/business/bharat-bandh-live-fuel-prices-hit-record-new-high-rupee-goes-down-to-historic-low/207068/,2018-09-10T05:39:29Z
35,"Bharat Bandh: Ashok Chavan, Sanjay Nirupam lead protests at Andheri station, block suburban railway tracks in Mumbai","As petrol prices on Monday shot up to Rs 89.97 in Maharashtra's Parbhani - the highest in India - the Opposition Congress staged a 'rail-roko' agitation in Mumbai The post Bharat Bandh: Ashok Chavan, Sanjay Nirupam lead protests at Andheri station, block subu…",https://www.firstpost.com/india/bharat-bandh-ashok-chavan-sanjay-nirupam-lead-protests-at-andheri-station-block-suburban-railway-tracks-in-mumbai-5151391.html,2018-09-10T05:39:01Z
36,Former PM Manmohan Singh hits out at Modi govt,"India News: NEW DELHI: Former Prime Minister Manmohan Singh on Monday lashed out at the Narendra Modi-led government, saying it has done a lot which is not in the.",https://timesofindia.indiatimes.com/india/former-pm-manmohan-singh-hits-out-at-modi-govt/articleshow/65749875.cms,2018-09-10T05:39:00Z
37,"Bharat Bandh LIVE updates: Sanjay Nirupam, Ashok Chavan arrested in Mumbai; Manmohan Singh calls Modi govt ‘despotic’","Bharat Bandh LIVE updates: Maharashtra Congress president Ashok Chavan was also arrested along with Mumbai Congress chief Sanjay Nirupam on Monday morning at the Andheri railway station. The post Bharat Bandh LIVE updates: Sanjay Nirupam, Ashok Chavan arreste…",https://www.firstpost.com/india/bharat-bandh-live-updates-sanjay-nirupam-ashok-chavan-arrested-in-mumbai-manmohan-singh-calls-modi-govt-despotic-5149371.html,2018-09-10T05:36:12Z
38,"Marked As World’s Tallest, Statue Of Sardar Patel To Be Unveiled By PM Modi On October 31","Prime Minister Narendra Modi will inaugurate a statue of Sardar Patel, India’s first home minister, on October 31, which is his birth anniversary. The Gujarat government has described the statue as the world’s tallest.  Gujarat CM Vijay Rupani said that the s…",https://www.indiatimes.com/news/india/marked-as-world-s-tallest-statue-of-sardar-patel-to-be-unveiled-by-pm-modi-on-october-31_-352756.html,2018-09-10T05:26:43Z
39,Amit Shah to lead BJP in Lok Sabha polls,Shah had replaced Rajnath Singh as the party president soon after it came to power in May 2014 as Singh quit his post following his inclusion in Prime Minister Narendra Modi#39;s Cabinet.,https://www.moneycontrol.com/news/politics/amit-shah-to-lead-bjp-in-lok-sabha-polls-2932851.html,2018-09-10T05:15:06Z
40,Switching to electric vehicles: Get ready for a long drive,The target of EVs by 2030 is more a statement of intent to give direction to policymakers.,https://economictimes.indiatimes.com/markets/stocks/news/switching-to-electric-vehicles-get-ready-for-a-long-drive/articleshow/65749582.cms,2018-09-10T05:13:02Z
41,"Bharat Bandh LIVE updates: Congress leader Sanjay Nirupam arrested at Andheri station during protests in Mumbai, say reports","Bharat Bandh LIVE updates: Mumbai Congress president Sanjay Nirupam has been arrested during protests at the Andheri railway station in the city, according to reports. The post Bharat Bandh LIVE updates: Congress leader Sanjay Nirupam arrested at Andheri stat…",https://www.firstpost.com/india/bharat-bandh-live-updates-congress-leader-sanjay-nirupam-arrested-at-andheri-station-during-protests-in-mumbai-say-reports-5149371.html,2018-09-10T05:12:12Z
42,Linkax LED Taktische Taschenlampe 2 Stück Superhelle 800 Lumen Taschenlampen Tragbare Zoombar Taschenlampe Outdoor Camping Handlampe Mit einstellbarem Fokus inklusive 6 AAA Batterie,"Elektro- und Handwerkzeuge online - Linkax LED Taktische Taschenlampe 2 Stück Superhelle 800 Lumen Taschenlampen Tragbare Zoombar Taschenlampe Outdoor Camping Handlampe Mit einstellbarem Fokus inklusive 6 AAA Batterie. <b>Die letzte Taschenlampe, die du jemal…",https://www.amazon.de/Linkax-Taschenlampe-Superhelle-Taschenlampen-einstellbarem/dp/B07FQQP43C,2018-09-10T05:10:01Z
43,"Bharat Bandh disrupts rail and road traffic in Bihar: RJD, Hindustani Awami Morcha, Left parties back shutdown","Rail and road traffic was hit across Bihar on Monday due to the Bharat Bandh called by the Congress against the hike in fuel prices. The shutdown is being supported by the opposition Rashtryia Janata Dal (RJD), Left Parties and Hindustani Awam Morcha (HAM). T…",https://www.firstpost.com/india/bharat-bandh-disrupts-rail-and-road-traffic-in-bihar-rjd-hindustani-awami-morcha-left-parties-back-shutdown-5150881.html,2018-09-10T05:05:09Z
44,"Ronaldo, riposo in yacht e vitamina D","(ANSA) - TORINO, 9 SET - ""Vitamima D"" assunta nel migliore dei modi: una giornata all'aria aperta su uno yacht a Montecarlo. Cristiano Ronaldo sfrutta i tre giorni di riposo concessi da Allegri ai suo",https://www.tuttomercatoweb.com/altre-notizie/ronaldo-riposo-in-yacht-e-vitamina-d-1155366,2018-09-10T05:04:55Z
45,"‘Arrogance’, opposition slams Amit Shah for saying 'BJP will rule India for 50 years'",Several opposition leaders reacted sharply to BJP president Amit Shah’s comment where he had claimed that his party will not only win 2019 Lok Sabha polls but will also remain in power for the next 50 years. Shah was chalking out his party's future strategy a…,https://timesofindia.indiatimes.com/india/arrogance-opposition-slams-shah-for-saying-bjp-will-rule-india-for-50-years/articleshow/65749439.cms,2018-09-10T05:02:59Z
46,"Bharat Bandh LIVE updates: Shutdown disrupts relief work in Kerala’s Thrissur, Ernakulam districts; Crucial train services blocked in Jharkhand","Bharat Bandh LIVE updates: The shutdown strike affected relief activities in the flood devastated areas in Ernakulam and Thrissur districts. Though the district administration in Ernakulam had directed all employees to attend office, the attendance was very t…",https://www.firstpost.com/india/bharat-bandh-live-congress-says-no-strike-in-kodagu-due-to-floods-but-no-such-rule-for-kerala-sp-bsp-missing-from-rahul-rally-5149371.html,2018-09-10T05:01:12Z
47,"Bharat Bandh today LIVE updates: Congress says no strike in Kodagu due to floods, but no such rule for Kerala; SP, BSP missing from Rahul rally","Bharat Bandh today LIVE updates: Kodagu DCC president Shivu Madappa has said that the Congress party will not support the bandh in wake of floods in the district. However, this is not the case with Kerala, which is still recovering from the devastating deluge…",https://www.firstpost.com/india/bharat-bandh-today-live-updates-congress-says-no-strike-in-kodagu-due-to-floods-but-no-such-rule-for-kerala-sp-bsp-missing-from-rahul-rally-5149371.html,2018-09-10T04:46:12Z
48,India faces protests over rising fuel prices,Opposition calls in India for a nationwide strike over rising fuel prices have left roads empty and businesses closed in some cities.,http://www.startribune.com/india-faces-protests-over-rising-fuel-prices/492837321/,2018-09-10T04:45:00Z
49,"Bharat Bandh: Rail, Road Traffic Hit In Bihar; Long Route Trains Halted",Rail and road traffic has been hit across Bihar today due to a nationwide shutdown called by the Congress against the hike in fuel prices.,https://www.ndtv.com/india-news/bharat-bandh-rail-road-traffic-hit-in-bihar-long-route-trains-halted-1913993,2018-09-10T04:44:29Z
50,"Statue of Unity to be unveiled by PM Modi on October 31, says Vijay Rupani",The Statue of Unity will be 182-metre tall when it is completed. It is being built as a tribute to India's first home minister Sardar Vallabhbhai Patel.,https://indianexpress.com/article/india/statue-of-unity-to-be-unveiled-by-pm-modi-on-october-31-says-vijay-rupani/,2018-09-10T04:42:22Z
51,Congress makes a symbolic start to Bharat Bandh over fuel prices,The Congress today started their Bharat Bandh demonstration at Delhi’s Rajghat to corner Narendra Modi-led government over fuel prices,https://www.livemint.com/Politics/nzEk64QVLsFFyxcjMK618O/Congress-makes-a-symbolic-start-to-Bharat-Bandh-over-fuel-pr.html,2018-09-10T04:36:24Z
52,"Rupee crashes past 72: Currency mayhem signals a deeper problem; India must think long-term, find solutions within","Undoubtedly, domestic factors have played a crucial role in the weakening of these currencies, but the significance of the strengthening dollar cannot be downplayed. The post Rupee crashes past 72: Currency mayhem signals a deeper problem; India must think lo…",https://www.firstpost.com/business/rupee-crashes-past-72-currency-mayhem-signals-a-deeper-problem-india-must-think-long-term-find-solutions-within-5150361.html,2018-09-10T04:16:24Z
53,"Bharat Bandh today LIVE updates: Buses, autos stay off roads in Karnataka’s Haveri; over 5,000 policemen deployed in Chennai","Bharat Bandh today LIVE updates: Over 5,000 police personnel have been deployed around Chennai to maintain peace during the bandh, with special focus on the central government buildings. The post Bharat Bandh today LIVE updates: Buses, autos stay off roads in…",https://www.firstpost.com/india/bharat-bandh-today-live-updates-buses-autos-stay-off-roads-in-karnatakas-haveri-over-5000-policemen-deployed-in-chennai-5149371.html,2018-09-10T04:16:12Z
54,Petrol inches close to Rs 81 a litre in Delhi after 5th straight price hike,"While Opposition parties led by the Congress have called for a 'Bharat Bandh' to protest the rising fuel prices in the country, Left parties have announced a separate shutdown of their own",https://www.business-standard.com/article/current-affairs/petrol-prices-hiked-for-5th-straight-day-touch-rs-80-73-litre-in-delhi-118091000115_1.html,2018-09-10T04:07:00Z
55,"In Jammu And Kashmir, Collector Pitches In With Toilet Construction","It is a race against time at Udhampur, in a remote corner of Jammu and Kashmir, where 1000 toilets are being built across 60 panchayats, under the Swachh Bharat Mission. Ravindra Kumar, the District Development Commissioner engaged in the construction activit…",https://www.ndtv.com/cities/in-jammu-and-kashmirs-udhampur-collector-pitches-in-with-toilet-construction-1913966,2018-09-10T03:49:57Z
