Id,Title,Description,URL,Timestamp
1,"Lexus, Seabourn, Tesla and Gucci – News briefs",Today in luxury - Lexus reveals the LY 650 luxury yacht; Luxury cruise line Seabourn launches 146-day world cruise; Tesla offers immediate delivery of Model 3 to select reservation holders; Gucci puts the logo front and center on its latest T-shirt.,https://www.luxurydaily.com/lexus-seabourn-tesla-and-gucci-news-briefs/,2018-09-11T06:30:11Z
2,Tesla Model S Can Be Hacked In Seconds With This Raspberry Pi-powered Equipment,"Tesla is the epitome of innovation combined with unmatched features, including utmost comfort and tight security that provides a completely digitized driving experience. However, it seems that hackers are always a step ahead. Researchers from KU Leuven Un",https://fossbytes.com/tesla-model-s-keyfob-hacked-equipment/,2018-09-11T05:20:53Z
3,This quadcopter is a 'flying battery' than can stay in the sky for 2 hours,"While most of today's drones can stay airborne for around half an hour tops, Impossible Aerospace's US-1 drone can fly for up to two hours. The feat was achieved by building the machine around a larger-than-usual battery, and the company says that if the desi…",https://www.digitaltrends.com/cool-tech/impossible-aerospace-us-1-flying-battery-drone/,2018-09-11T05:15:51Z
4,China’s factory base rolls out red carpet for big foreign investors as trade war begins to bite,"Guangdong province, the centre of China’s export industry, is redoubling its efforts to woo foreign investors to counterbalance the increasing impact of the trade war with the United States. The provincial government has updated its foreign direct investment …",https://www.scmp.com/economy/china-economy/article/2163680/chinas-factory-base-rolls-out-red-carpet-big-foreign-investors,2018-09-11T05:02:57Z
5,Lehman Brothers collapse: where are the key figures now?,Ten years ago this weekend the investment bank’s bankruptcy caused panic in US and UK Ten years ago this weekend Lehman Brothers crashed into bankruptcy – the biggest corporate failure in history – and sent the world’s financial system reeling close to collap…,https://www.theguardian.com/business/2018/sep/11/lehman-brothers-collapse-where-are-the-key-figures-now,2018-09-11T05:00:10Z
6,"Embattled Ontario Premier Doug Ford makes history, notwithstanding","Most of MetaFilter has had little political news from Toronto since its, er, colourful mayor Rob Ford ( previously ) declined to run for re-election due to ill health before passing away at age 46. But wait, there is a sequel: Rob's brother, one-term Toronto …",http://www.metafilter.com/176448/Embattled-Ontario-Premier-Doug-Ford-makes-history-notwithstanding,2018-09-11T04:48:49Z
7,Elon Musk Elevates a Little-Known Fixer to Steer Tesla Past Drama,"Outside the walls of Tesla, Jerome Guillen is hardly a household name.",https://gadgets.ndtv.com/transportation/news/elon-musk-elevates-a-little-known-fixer-to-steer-tesla-past-drama-1914596,2018-09-11T04:41:27Z
8,Snap Chief Strategy Officer Imran Khan Leaves in Latest Executive Departure,"Snap, the parent of Snapchat messaging, said on Monday Chief Strategy Officer Imran Khan will step down, the latest top-level exit amid pressure to stem a drop in users.",https://gadgets.ndtv.com/apps/news/snapchat-cso-imran-khan-departs-1914587,2018-09-11T04:29:46Z
9,"S&P, Nasdaq edge higher after recent losses but Apple drags",Republicans to unveil new round of tax cuts this week,https://www.thehindubusinessline.com/markets/stock-markets/sp-nasdaq-edge-higher-after-recent-losses-but-apple-drags/article24922711.ece,2018-09-11T04:21:07Z
10,Tesla Wireless Phone Charger will return with a price cut,Remember that Tesla-branded wireless charger that suddenly disappeared as quickly as it showed up? Apparently disappearing and reappearing is its most distinctive quality. The phone accessory reappeared on Tesla’s store only to disappear again after quickly s…,https://www.slashgear.com/tesla-wireless-phone-charger-will-return-with-a-price-cut-10545089/,2018-09-11T04:15:48Z
11,Markets send Tesla a message about funding needs,"Although Elon Musk insists otherwise, many believe electric car maker must raise money",https://www.ft.com/content/af83206e-b279-11e8-99ca-68cf89602132,2018-09-11T04:11:01Z
12,"With his retirement plan, Jack Ma is teaching a few leadership lessons","With his retirement plan, Jack Ma is teaching a few leadership lessons",https://www.indiatoday.in/technology/talking-points/story/with-his-retirement-plan-jack-ma-is-teaching-a-few-leadership-lessons-1337332-2018-09-11,2018-09-11T03:52:00Z
13,"Tesla is planning to restock its 6,000mAh wireless charger at a reduced price","Tesla's Wireless Charger from a couple weeks back had quite an impressive response, leading it to sell out quickly. Now, the firm is apparently going to restock the item and offer it at a lower price. Read more...",https://www.neowin.net/news/tesla-is-planning-to-restock-its-6000mah-wireless-charger-at-a-reduced-price/,2018-09-11T03:50:01Z
14,Tesla shares bounce as Musk risk seen as overblown,Much of the pressure on Tesla shares over the last month has been due to the sense Elon Musk is 'running wild and can't be contained' following a patch of erratic behaviour.,https://www.freemalaysiatoday.com/category/business/2018/09/11/tesla-shares-bounce-as-musk-risk-seen-as-overblown/,2018-09-11T03:45:39Z
15,The hashtag (#) just turned 11. Is it time to celebrate?,"On the hashtag's 10-year anniversary last year, Twitter's co-founder Biz Stone recounted how the hashtag symbol came to be so iconic",https://www.business-standard.com/article/economy-policy/the-hashtag-just-turned-11-is-it-time-to-celebrate-118091100105_1.html,2018-09-11T03:21:00Z
16,"Tesla tumbles on new executive departures, Musk interview","New York (AFP) Sept 7, 2018 Shares of Tesla Motors tumbled Friday as investors were rattled by the departures of two executives and a late-night interview in which chief executive Elon Musk was seen smoking marijuana. Tesla shares sank 6.3 to close at $263.24…",http://www.spacedaily.com/reports/Tesla_tumbles_on_new_executive_departures_Musk_interview_999.html,2018-09-11T03:17:02Z
17,Tesla increases price of Model 3 Dual Motor AWD again,"Tesla can’t seem to make up its mind when it comes to the price of Dual Motor All-Wheel-Drive option of the Model 3. The automaker is now changing the price for their third time in a few months – making it 20% more expensive at $6,000. more…",https://electrek.co/2018/09/10/tesla-model-3-dual-motor-awd-price-increase/,2018-09-11T03:10:07Z
18,"Four Relative Positions in Gold, Oil, FX Majors and Tech Shares for Signal and Opportunity",Gold’s performance relative to silver may make its haven status more appealing. Other assets are also worth watching for the influence of tariffs.,https://www.dailyfx.com/forex/video/live_events/2018/09/11/Four-Relative-Positions-in-Gold-Oil-FX-Majors-and-Tech-Shares-for-Signal-and-Opportunity.html,2018-09-11T02:53:00Z
19,"Tesla to restock sold-out wireless phone charger, cut price by $16","After quickly selling out of a sleek but underpowered wireless smartphone charger in late August, Tesla this week informed customers that the device will soon be back in stock at a roughly $16 discount. Tesla is in the process of emailing customers who purcha…",https://appleinsider.com/articles/18/09/10/tesla-to-restock-sold-out-wireless-phone-charger-cut-price-by-16,2018-09-11T02:40:30Z
20,Snapchat’s parent company’s chief strategy officer Imran Khan to step down,Khan was named to the role in 2015 and played a key part in taking Snap public in March of 2017. The post Snapchat’s parent company’s chief strategy officer Imran Khan to step down appeared first on Firstpost.,https://www.firstpost.com/tech/news-analysis/snapchats-parent-companys-chief-strategy-officer-imran-khan-to-step-down-5157901.html,2018-09-11T02:29:44Z
21,"Tesla to eliminate some paint options to increase production efficiency, gives last chance to order","Tesla is telling customers that it is about to eliminate some paint options for Model S, Model X and Model 3 “in order to increase production, delivery and service efficiency.” The automaker is offering customers a last chance to order them. more…",https://electrek.co/2018/09/10/tesla-model-3-paint-options-removed-increase-production-efficiency/,2018-09-11T02:28:23Z
22,APPLE becomes most shorted company ahead of iPhone launch...,"Short sellers have circled Apple on the eve of the tech giant&rsquo;s highly-anticipated iPhone launch, with the tech giant becoming America&rsquo;s most bet-against company.",https://www.telegraph.co.uk/technology/2018/09/10/apple-becomes-shorted-us-company-ahead-iphone-launch/,2018-09-11T02:04:37Z
23,There's Still No Chance That Apple Will Buy Tesla,"Tesla fans love the idea, but it isn't happening. Here's why.",https://www.fool.com/investing/2018/09/10/theres-still-no-chance-that-apple-will-buy-tesla.aspx,2018-09-11T01:47:00Z
24,"SP, Nasdaq edge higher after recent losses but Apple drags","The Dow Jones Industrial Average fell 20.89 points, or 0.08 percent, to 25,895.65, the S&P 500 gained 8.43 points, or 0.29 percent, to 2,880.11 and the Nasdaq Composite added 25.69 points, or 0.33 percent, to 7,928.23.",https://www.moneycontrol.com/news/business/markets/sp-nasdaq-edge-higher-after-recent-losses-but-apple-drags-2939141.html,2018-09-11T01:45:20Z
25,Snap chief strategy officer leaves in latest executive departure,"By Akanksha Rana (Reuters) - Snap Inc, the parent of Snapchat messaging, said on Monday Chief Strategy Officer Imran Khan will step down, the latest top-level exit amid pressure to stem a drop in users following a controversial redesign of the app. Khan, 41, …",https://www.firstpost.com/business/snap-chief-strategy-officer-leaves-in-latest-executive-departure-5157751.html,2018-09-11T01:35:15Z
26,"DOTS, now with more Galaxy!","Mmmm I love the Galaxy S7&#39;s camera. This is the second Tesla to appear in the parking lot, the other is a 100D Model S owned by the President of the company. Read more...",https://oppositelock.kinja.com/dots-now-with-more-galaxy-1828955075,2018-09-11T00:52:26Z
27,"Your Tesla is probably vulnerable to hackers, but there's an easy fix - Yahoo Finance UK","Yahoo Finance UK Your Tesla is probably vulnerable to hackers, but there's an easy fix Yahoo Finance UK Hackers can likely quickly and easily steal your Tesla Model S, but this high-tech heist comes with a catch: There's a simple way to prevent it. Researcher…",https://slashdot.org/firehose.pl?op=view&amp;id=102710238,2018-09-11T00:52:08Z
28,"S&P, Nasdaq edge higher after recent losses but Apple drags",US President Donald Trump says he is ready to levy additional taxes on practically all Chinese imports.,https://www.freemalaysiatoday.com/category/business/2018/09/11/sp-nasdaq-edge-higher-after-recent-losses-but-apple-drags/,2018-09-11T00:40:47Z
29,2018 Tesla Model 3 Dual Motor Performance Quick Test Review - Motor Trend,"Motor Trend 2018 Tesla Model 3 Dual Motor Performance Quick Test Review Motor Trend Every push notification or swipe up seems to bring more brow-furrowing news about Tesla, mostly due to the mystifying moves of its chief executive. So many questions swirl—wha…",https://slashdot.org/firehose.pl?op=view&amp;id=102710050,2018-09-11T00:32:10Z
30,Tesla invests $680 million into Gigafactory 3 in China,"Sina Finance reports that Tesla Shanghai has registered a capital increase to 4.67 billion yuan (US$680 million.) In May 2018, Tesla (Shanghai) got a business license and TESLA MOTORS HK LIMITED was... [[ This is a content summary only. Visit my website for f…",https://www.nextbigfuture.com/2018/09/tesla-invests-680-million-into-gigafactory-3-in-china.html,2018-09-11T00:24:02Z
31,"2018 Tesla Model 3 Performance review: Unholy quick, but still incomplete - CNET","CNET 2018 Tesla Model 3 Performance review: Unholy quick, but still incomplete CNET Reviewing Teslas can be challenging. They are, you see, always changing. Everything from Autopilot capability to the braking performance of the Model 3 has been tweaked since …",https://slashdot.org/firehose.pl?op=view&amp;id=102709842,2018-09-11T00:12:30Z
32,Tesla is bringing back its wireless smartphone charger at a discount,"Tesla has started informing customers that its wireless smartphone charger, which quickly went out of stock late last month, will be returning to its online store at a roughly $15 discount, with the electric car maker citing a larger manufacturing quantity as…",https://www.theverge.com/circuitbreaker/2018/9/10/17843996/tesla-wireless-smartphone-charger-return-restock-discount,2018-09-11T00:07:45Z
33,Tesla shares bounce as Musk risk seen as overblown,"NEW YORK: Tesla shares bounced Monday (Sep 10) following an upbeat analyst note that suggested worries about chief executive Elon Musk and his various controversies were exaggerated. Alliance Bernstein analyst Toni Sacconaghi, Jr said much of the pressure on …",https://www.channelnewsasia.com/news/business/tesla-shares-bounce-as-musk-risk-seen-as-overblown-10704088,2018-09-10T23:40:37Z
34,"How Many Vehicles Will Tesla, Inc. Sell in Q3?",It's going to be another wildcard quarter.,https://www.fool.com/investing/2018/09/10/how-many-vehicles-will-tesla-inc-sell-in-q3.aspx,2018-09-10T23:21:00Z
35,"Tesla's Keyless Entry Vulnerable To Spoofing Attack, Researchers Find","An anonymous reader quotes a report from The Verge: Researchers at KU Leuven have figured out a way to spoof Tesla's key fob system, as first reported by Wired. The result would let an attacker steal a Tesla simply by walking past the owner and cloning his ke…",https://mobile.slashdot.org/story/18/09/10/2121234/teslas-keyless-entry-vulnerable-to-spoofing-attack-researchers-find,2018-09-10T23:20:00Z
36,Forget the stock. Tesla's bonds are imploding,"The bonds traded for just 84 cents on the dollar, down from 98 cents a year ago.",http://cnnphilippines.com/business/2018/09/11/Tesla-bonds-imploding.html,2018-09-10T23:11:07Z
37,"Researchers Show Off Method for Hacking Tesla's Keyless Entry, So Turn on Two-Factor Encryption",Elon Musk started the day with some much-needed good news after Space X pulled off an early morning satellite launch without any troubles. The good news didn’t last long because on Monday afternoon security researchers went public with claims that Tesla’s key…,https://gizmodo.com/researchers-show-off-method-for-hacking-tesla-s-keyless-1828951056,2018-09-10T22:55:00Z
38,Tesla Model S key fobs were vulnerable to a low-tech hack - Roadshow,Researchers from a Belgian university found the weakness and Tesla has already fixed the issue.,https://slashdot.org/firehose.pl?op=view&amp;id=102709164,2018-09-10T22:53:40Z
39,Thief steals Tesla from mall using smartphone - Green Car Reports,"Green Car Reports Thief steals Tesla from mall using smartphone Green Car Reports Cybersecurity is big for cars, and a Tesla proved why last week. The thief used Tesla's smartphone app to open and drive away in a Model S from the Mall of America, in Bloomingt…",https://slashdot.org/firehose.pl?op=view&amp;id=102709148,2018-09-10T22:52:17Z
40,Tesla's Bonds Tell A Perilous Story,Tesla bond yields are hitting all-time highs. The company seems to be attempting to engineer a one-off profit. The bond market is unlikely to be convinced by un,https://seekingalpha.com/article/4205414-teslas-bonds-tell-perilous-story,2018-09-10T22:26:57Z
41,Tesla shares climb on Musk’s promise of ‘amazing’ quarter,"Tesla shares climbed nearly 9 percent on Monday as investors reacted to Elon Musk on Friday evening predicting “the most amazing quarter in our history.” The electric-car maker finished the day up 8.5 percent, at $285.50, a boost that was also fueled by Baird…",https://nypost.com/2018/09/10/tesla-shares-climb-on-musks-promise-of-amazing-quarter/,2018-09-10T22:24:54Z
42,Tesla CEO’s Toke Blunts Networks’ Jobs Coverage,"Tesla CEO Elon Musk acting strangely and smoking marijuana took priority over an good economic update on jobs. Six times more. ABC, CBS and NBC evening news programs on Sept. 7, spent more than 6 times as much of those broadcasts reporting that Tesla and Spac…",https://www.newsbusters.org/blogs/business/julia-seymour/2018/09/10/tesla-ceos-toke-blunts-networks-jobs-coverage,2018-09-10T22:24:20Z
43,Air Force looking into Musk's security clearance over pot smoking,,https://govtslaves.info/story/air-force-looking-into-musks-security-clearance-over-pot-smoking/,2018-09-10T22:24:19Z
44,Commentary: The trouble with 'Made in China',"Amidst a trade war with the United States, China toned down its ""Made in China 2025"" plan.",https://www.channelnewsasia.com/news/commentary/made-in-china-us-trade-war-great-power-competition-10626054,2018-09-10T22:15:10Z
45,Musk elevates Tesla's little-known fixer to steer past drama,"Outside Tesla Inc., Jerome Guillen is hardly a household name. But to some of the earliest, die-hard customers who bought Tesla’s first Model S sedans, a fixer is getting the promotion he deserves, and Chief Executive Elon Musk is getting help he desperately …",http://www.latimes.com/business/la-fi-tesla-musk-fixer-guillen-20180910-story.html,2018-09-10T22:10:00Z
46,Tesla Key Fob Security Allows for a Hacker to Steal a Car in Less Than 30 Seconds,"Tesla has updated their key fob technology and added a pin code on the Tesla Model S to counter a new hack discovered by researchers at the KU Leuven University in Belgium, that allows a car thief to steal a Tesla in less than 30 seconds.  Basically the Pektr…",http://www.hardocp.com/news/2018/09/10/tesla_key_fob_security_allows_for_hacker_to_steal_car_in_less_than_30_seconds/,2018-09-10T22:09:00Z
47,"io9 A Guide to Starforce, Captain Marvel’s Kree Superteam | Kotaku The Internet Reacts To Kanye Wes","io9 A Guide to Starforce, Captain Marvel ’s Kree Superteam | Kotaku The Internet Reacts To Kanye West’s Bizarre New Video | Jalopnik The 2018 Tesla Model 3 Long Range Is the Perfect Mix of Ordinary and Revolutionary | Lifehacker What to Do With Your Old Apple…",https://kinjaroundup.kinja.com/io9-a-guide-to-starforce-captain-marvel-s-kree-superte-1828951866,2018-09-10T22:07:00Z
48,Elon Musk On Joe Rogan,"They’re out to get him. I didn’t like school, because the teachers were so bad. Forget that they were limited. they wanted to keep you in a box. Make sure you were somebody contrary to your inner tuning fork. They wanted you to conform. But when you found a t…",http://ritholtz.com/2018/09/elon-musk-on-joe-rogan/,2018-09-10T22:00:44Z
49,"How to get into your, or somebody else's, Tesla","Want to get into a Tesla or McLaren, even if it’s not strictly speaking yours? Read more...",https://oppositelock.kinja.com/how-to-get-into-your-or-somebody-elses-tesla-1828951570,2018-09-10T21:54:00Z
50,2018 Tesla Model 3 Performance review: - CNET,"CNET 2018 Tesla Model 3 Performance review: CNET The Good The Model 3 Performance is impressively quick yet offers great range and practicality. The Bad Interior quality and features are still lacking, especially for a car that starts at $64,000. The Bottom L…",https://slashdot.org/firehose.pl?op=view&amp;id=102708718,2018-09-10T21:52:16Z
51,"S&P, Nasdaq edge higher after recent losses but Apple drags","NEW YORK: U.S. stocks mostly edged higher on Monday, with the S&P 500 and Nasdaq rebounding to snap a four-day losing streak, although a drop in Apple kept gains in check.",http://www.thestar.com.my/business/business-news/2018/09/11/sp-nasdaq-edge-higher-after-recent-losses-but-apple-drags/,2018-09-10T21:50:51Z
52,Tesla Model S key fobs were vulnerable to a low-tech hack - Roadshow,Researchers from a Belgian university found the weakness and Tesla has already fixed the issue.,https://www.cnet.com/roadshow/news/tesla-model-s-key-fob-hack/,2018-09-10T21:45:09Z
53,US stocks end mostly higher ahead of data,Wall Street stocks finished mostly higher on Monday (Sep 10) despite lingering trade tensions as investors went bargain hunting after last week's losses.,https://www.channelnewsasia.com/news/business/us-stocks-end-mostly-higher-ahead-of-data-10703978,2018-09-10T21:40:37Z
54,California's bad IoT law,"It’s based on the misconception of adding security features. It’s like dieting, where people insist you should eat more kale, which does little to address the problem you are pigging out on potato chips. The key to dieting is not eating more but eating less.",https://blog.erratasec.com/2018/09/californias-bad-iot-law.html,2018-09-10T21:36:00Z
55,Thieves could have cloned Tesla's Model S key fob - Engadget,"Engadget Thieves could have cloned Tesla's Model S key fob Engadget Tesla may be more security-conscious than many car manufacturers, but it's still vulnerable to the occasional glaring exploit. KU Leuven researchers have detailed a technique that let them by…",https://slashdot.org/firehose.pl?op=view&amp;id=102708604,2018-09-10T21:32:43Z
56,“Million Solar Roofs of Energy Storage” Bill Approved By California Legislature,The California legislature has approved a bill that will add $830 million in incentives to add behind the meter storage for homeowners and small businesses over the next 5 years.,https://cleantechnica.com/2018/09/10/million-solar-roofs-of-energy-storage-bill-approved-by-california-legislature/,2018-09-10T21:30:41Z
57,Baird: Buy Tesla shares 'even with drama',Shares of Tesla finished higher after Baird analyst Ben Kallo reiterated his 'buy' rating on Tesla after a factory tour.,https://finance.yahoo.com/video/baird-buy-tesla-shares-even-212355142.html,2018-09-10T21:23:55Z
58,"Tesla's Keyless Entry Vulnerable To Spoofing Attack, Researchers Find","Researchers at KU Leuven have figured out a way to spoof Tesla’s key fob system, as first reported by Wired. The result would let an attacker steal a Tesla simply by walking past the owner and cloning his key. The attack is particularly significant because Te…",https://slashdot.org/submission/8582166/teslas-keyless-entry-vulnerable-to-spoofing-attack-researchers-find,2018-09-10T21:20:46Z
59,Fin24.com | Musk scores a much-needed win with successful SpaceX launch,"Space Exploration Technologies has launched a commercial satellite for Telesat from Florida, marking the rocket company’s 16th mission of 2018.",https://www.fin24.com/Companies/ICT/musk-scores-a-much-needed-win-with-successful-spacex-launch-20180910,2018-09-10T21:18:22Z
60,California’s bad IoT law,"California has passed an IoT security bill, awaiting the government’s signature/veto. It’s a typically bad bill based on a superficial understanding of cybersecurity/hacking that will do little improve security, while doing a lot to impose costs and harm inno…",https://securityboulevard.com/2018/09/californias-bad-iot-law/,2018-09-10T21:15:00Z
61,"If You Missed Out on Tesla and Ferrari, Watch This IPO",British supercar maker Aston Martin is going public. Here's why investors should take note.,https://www.fool.com/investing/2018/09/10/if-you-missed-out-on-tesla-and-ferrari-watch-this.aspx,2018-09-10T21:15:00Z
62,Technically Speaking For September 10,"Volvo has scrapped its IPO for now, which plays into the bigger them of a lower number of IPOs over the last 10 years. Boston Fed President Rosengren is arguing",https://seekingalpha.com/article/4205405-technically-speaking-september-10,2018-09-10T21:09:35Z
63,"Tesla’s keyless entry vulnerable to spoofing attack, researchers find","Researchers at KU Leuven have figured out a way to spoof Tesla’s key fob system, letting an attacker steal a Tesla Model S simply by walking past the owner and cloning his key.",https://www.theverge.com/2018/9/10/17842136/tesla-key-fob-hack-theft-spoofing-relay,2018-09-10T21:05:34Z
64,Tesla Model 3 Performance achieves record 0-60 mph acceleration of 3.13 secs with new wheels & tires,Tesla Model 3 Performance owners are still experimenting with the performance of their new electric vehicles. An owner has now achieved a new record 0-60 mph acceleration of 3.13 secs with new wheels and tires. more…,https://electrek.co/2018/09/10/tesla-model-3-performance-new-record-0-60-mph-acceleration-wheels-tires/,2018-09-10T21:01:52Z
65,Top tech guru calls for a complete overhaul of Tesla's board,"Loup Ventures' Gene Munster calls for a complete overhaul of Tesla's board. Is Musk hurting Tesla? With CNBC's Melissa Lee and the Fast Money traders, Tim Seymour, Brian Kelly, Steve Grasso and Guy Adami.",https://www.cnbc.com/video/2018/09/10/top-tech-guru-calls-complete-overhaul-teslas-board.html,2018-09-10T21:00:00Z
66,"Gene Munster: If Tesla doesn't overhaul the board right now, it could spell the end for the company",Loup Ventures founder Gene Munster calls for an overhaul of Tesla's board in order to save the company.,https://www.cnbc.com/2018/09/10/gene-munster-tesla-must-overhaul-board-right-now.html,2018-09-10T20:59:00Z
67,A group of researchers showed how a Tesla Model S can be hacked and stolen in seconds using only $600 worth of equipment (TSLA),A Raspberry Pi mini-computer. Alphr. Researchers from KU Leuven university in Belgium demonstrated that hackers can secretly clone the key fob of a Tesla Model S and steal the car within seconds — and with only $600 worth of simple computing and radio equipme…,http://uk.businessinsider.com/tesla-model-s-could-be-hacked-stolen-600-dollars-equipment-2018-9,2018-09-10T20:55:00Z
68,Why this Audi will easily navigate toll roads,Audi is giving its upcoming e-tron electric crossover an extra blanket of convenience with a toll payment technology that will be compatible with certain toll roads in the U.S. and Canada.,http://www.autonews.com/article/20180910/OEM/180919929/e-tron-cross-over-toll-technology,2018-09-10T20:54:33Z
