Id,Title,Description,URL,Timestamp
69,Microsoft details for the first time how it classifies Windows security bugs,The Microsoft Security Response Center publishes two documents detailing internal procedures used by its staff to prioritize and classify security bugs.,https://www.zdnet.com/article/microsoft-details-for-the-first-time-how-it-classifies-windows-security-bugs/,2018-09-10T20:46:00Z
70,What’s McLaren Planning to Do With This New Electric Powertrain?,"McLaren’s Formula One cars have been fairly terrible as of late, but its high-end road cars are unimpeachable. They’re big, beefy, twin-turbo V8 carbon-eaters, although McLaren admits the future is electrified and possibly even fully electric. So an announcem…",https://jalopnik.com/what-s-mclaren-planning-to-do-with-this-new-electric-po-1828943793,2018-09-10T20:45:00Z
71,"Why Tesla, Carvana, and Tilray Jumped Today",Find out what made these stocks go higher.,https://finance.yahoo.com/news/why-tesla-carvana-tilray-jumped-204100537.html,2018-09-10T20:41:00Z
72,"Why Tesla, Carvana, and Tilray Jumped Today",Find out what made these stocks go higher.,https://www.fool.com/investing/2018/09/10/why-tesla-carvana-and-tilray-jumped-today.aspx,2018-09-10T20:41:00Z
73,Watch: Hackers Show How to Quickly Steal a Tesla Model S,Researchers could open and drive certain vehicles by cloning key fobs,https://www.infowars.com/watch-hackers-show-how-to-quickly-steal-a-tesla-model-s/,2018-09-10T20:38:31Z
74,Tesla shares climb 8 percent after bullish analyst reports,Tesla stock jumped 8 percent on Monday.,https://www.cnbc.com/2018/09/10/tesla-shares-climb-8-percent-after-two-bullish-analyst-reports.html,2018-09-10T20:38:00Z
75,China is the world leader in drones. US drone makers want to change that,The first US drone companies couldn't compete with DJI. Now that may change.,https://money.cnn.com/2018/09/10/technology/drones-american-made/index.html,2018-09-10T20:34:06Z
76,Thieves could have cloned Tesla's Model S key fob,"Tesla may be more security-conscious than many car manufacturers, but its still vulnerable to the occasional glaring exploit.  KU Leuven researchers have detailed a technique that let them bypass the encryption on Teslas key fob for the Model S, ma...",https://slashdot.org/firehose.pl?op=view&amp;id=102708020,2018-09-10T20:32:56Z
77,Pregnant mom killed in freak accident involving deer hit by another driver,"Sara Steiner, 35, was driving in Nebraska with her husband on Friday when a deer struck by a Tesla SUV came flying through her windshield, inflicting fatal injuries on the expectant mom.",https://www.dailymail.co.uk/news/article-6152795/Pregnant-mom-killed-freak-accident-involving-deer-hit-driver.html,2018-09-10T20:32:43Z
78,The Fastest Selling Late Model Used Vehicle Isn’t A Crossover Or Pickup,The new study shows consumers want affordable hybrid and electric vehicles.,https://www.carscoops.com/2018/09/fastest-selling-late-model-used-vehicle-isnt-crossover-pickup/,2018-09-10T20:30:52Z
79,Tesla shares bounce as Musk risk seen as overblown,Tesla shares bounced Monday following an upbeat analyst note that suggested worries about chief executive Elon Musk and his various controversies were exaggerated.,https://phys.org/news/2018-09-tesla-musk-overblown.html,2018-09-10T20:20:02Z
80,Tesla Battery Patent Application Refines Liquid Cooled Batteries,A new patent application from Tesla describes a new way to liquid cool the battery pack in an electric vehicle.,https://www.forbes.com/sites/sebastianblanco/2018/09/10/tesla-battery-liquid-cooling-patent-application/,2018-09-10T20:15:00Z
81,Tesla offers immediate delivery of Model 3 to select reservation holders - Roadshow,Tesla might be looking to free up some cash by getting cars to customers ahead of schedule.,https://slashdot.org/firehose.pl?op=view&amp;id=102707822,2018-09-10T20:13:43Z
82,Kelly McParland: Premier Ford won’t let courts come between him and the people,Ford is new to office and clearly believed that he was free to exercise powers that come under the mandate of the province,https://nationalpost.com/opinion/kelly-mcparland-premier-ford-wont-let-courts-come-between-him-and-the-people,2018-09-10T20:04:16Z
83,FANG-Less Stocks Drift Aimlessly As Trade War Tensions Loom,"With US traders starting the new week amid concerns of more bad news on the trade front - at least those who were not out for Rosh Hashanah - and further profit taking in the FANG complex, the final result was probably better than most had expected. The day s…",https://www.zerohedge.com/news/2018-09-10/fang-less-stocks-drift-aimlessly-trade-war-tensions-loom,2018-09-10T20:04:15Z
84,Security flaws in Tesla and McLaren keyless entry found,"Belgian University team uncovers serious hacking risk to keyless entry system developed by Pektron A team of researchers at the University of Leuven, Belgium, have uncovered a serious security flaw in a keyless entry and start system used by brands such as Te…",https://www.autocar.co.uk/car-news/new-cars/security-flaws-tesla-and-mclaren-keyless-entry-found,2018-09-10T20:00:55Z
85,Thieves could have cloned Tesla's Model S key fob,"Tesla may be more security-conscious than many car manufacturers, but it's still vulnerable to the occasional glaring exploit. KU Leuven researchers have detailed a technique that let them bypass the encryption on Tesla's key fob for the Model S, ma...",https://www.engadget.com/2018/09/10/tesla-model-s-key-fob-cloning-vulnerability/,2018-09-10T19:52:00Z
86,"S&P, Nasdaq edge higher after recent losses but Apple drags",U.S. stocks opened higher on Monday as hopes for a fresh round of tax cuts overshadowed fears of an escalation in the trade war between the United States and China.,https://www.channelnewsasia.com/news/business/s-p--nasdaq-edge-higher-after-recent-losses-but-apple-drags-10702978,2018-09-10T19:45:29Z
87,Mark Zuckerberg Wrote a Computer Program to Beat a High Schooler At Scrabble,"Over the weekend, the New Yorker published an extensive and intimate profile of Facebook CEO Mark Zuckerberg, a rarity given his aversion to speaking to the press. Longtime staff writer Evan Osnos visited Zuckerberg’s home and conducted a series of interviews…",https://slate.com/technology/2018/09/mark-zuckerberg-facebook-new-yorker-profile-scrabble.html,2018-09-10T19:44:43Z
88,A group of researchers showed how a Tesla Model S can be hacked and stolen in seconds using only $600 worth of equipment (TSLA),"Researchers from KU Leuven university in Belgium demonstrated that hackers can secretly clone the key fob of a Tesla Model S and steal the car within seconds — and with only $600 worth of simple computing and radio equipment, WIRED reports. The researchers br…",https://www.businessinsider.com/tesla-model-s-could-be-hacked-stolen-600-dollars-equipment-2018-9,2018-09-10T19:39:52Z
89,"US STOCKS-S&P, Nasdaq edge higher after recent losses...","By Caroline ValetkevitchNEW YORK, Sept 10 (Reuters) - U.S. stocks mostly edged  higher on Monday, rebounding slightly after last week's losses,  although a...",https://www.dailymail.co.uk/wires/reuters/article-6152697/US-STOCKS-S-P-Nasdaq-edge-higher-recent-losses-Apple-drags.html,2018-09-10T19:39:41Z
90,"US STOCKS-S&P, Nasdaq edge higher after recent losses but Apple drags","U.S. stocks mostly edged higher on Monday, rebounding slightly after last week's losses, although a drop in Apple kept gains in check.",https://www.reuters.com/article/usa-stocks/us-stocks-sp-nasdaq-edge-higher-after-recent-losses-but-apple-drags-idUSL2N1VW149,2018-09-10T19:39:03Z
91,Broker Received Passwords from Westpac Employee,"Broker Received Passwords from Westpac EmployeeAustralian banks have made headlines once again with reports that a former employee shared customer information with a mortgage broker. According to news from the Australian Broadcasting Company (ABC), a manager …",http://www.newslocker.com/en-uk/profession/security/broker-received-passwords-from-westpac-employee/,2018-09-10T19:38:00Z
92,Pierce Bainbridge Investigating a Potential Class Action Against Tesla,"NEW YORK, Sept. 10, 2018 /PRNewswire/ -- Pierce Bainbridge Beck Price & Hecht LLP is investigating whether Tesla (NASDAQ: TSLA) violated federal securities laws. If you or your company recently purchased or sold Tesla shares, bonds, or options and have lost o…",https://www.prnewswire.com/news-releases/pierce-bainbridge-investigating-a-potential-class-action-against-tesla-300709884.html,2018-09-10T19:37:00Z
93,What's McLaren Planning To Do With This New Electric Powertrain?,"McLaren’s Formula One cars have been fairly terrible as of late, but its high-end road cars are unimpeachable. They’re big, beefy, twin-turbo V8 carbon-eaters, although McLaren admits the future is electrified and possibly even fully electric. So an announcem…",https://www.gizmodo.com.au/2018/09/whats-mclaren-planning-to-do-with-this-new-electric-powertrain/,2018-09-10T19:30:00Z
94,Tesla May Emerge a Winner in Nevada’s Toss-Up Senate Race,"Interesting look at how a tight Senate race in Nevada might end up with electric vehicles the real winner, as the incumbent and challenger are both pushing for electric vehicle measures at the.. Click headline for full article",https://www.energycentral.com/c/ec/tesla-may-emerge-winner-nevada%E2%80%99s-toss-senate-race?utm_source=PANTHEON_STRIPPED&utm_medium=PANTHEON_STRIPPED&utm_campaign=PANTHEON_STRIPPED,2018-09-10T19:19:40Z
95,Stocks fight for gains following last week's sharp losses - Yahoo News,"Stocks fight for gains following last week's sharp losses Yahoo News Stocks are fighting for gains here, as tech looks to rebound after a tough week. Plus, Les Moonves gets the boot as more allegations emerge. What it means for a CBS–Viacom tie up. And, one a…",https://finance.yahoo.com/news/stocks-fight-gains-following-last-weeks-sharp-losses-191838032.html,2018-09-10T19:19:25Z
96,Researchers Figured Out How to Hack a Tesla’s Locks in Under Two Seconds,A team of researchers demonstrates how they hacked Tesla fobs.,https://motherboard.vice.com/en_us/article/438ydj/break-into-a-tesla-key-fob-lock,2018-09-10T19:18:16Z
97,Italian relief rally brings comfort to financial stocks,Shares in AIB and Bank or Ireland rise as optimism sweeps European financial sector,https://www.irishtimes.com/business/markets/italian-relief-rally-brings-comfort-to-financial-stocks-1.3624651,2018-09-10T19:14:56Z
98,"Ignore Elon Musk's Tweets, Listen to the Bond Market","To be clear, any time a high-profile CEO of a major, multi-billion dollar automotive company goes off the proverbial rails on social media it concerns us, but … there is a much bigger issue at play right now—namely Tesla’s liquidity.",https://www.forbes.com/sites/daryljones/2018/09/10/ignore-elon-musks-tweets-listen-to-the-bond-market/,2018-09-10T19:14:00Z
99,Elon Musk said Tesla is about to have the 'most amazing quarter' in its history — here's what workers think of his prediction (TSLA),"In what has been a pressure-filled year for Tesla, the company's third-quarter performance might be its most important test in 2018. On Friday, CEO Elon Musk said in an email to employees that was posted on Tesla's website that the third quarter will be the ""…",https://www.businessinsider.com/tesla-workers-share-insight-on-elon-musks-bold-q3-prediction-2018-9,2018-09-10T19:11:25Z
100,'A ray of sunshine:' Family devastated by freak crash involving pregnant woman,"Sara Steiner was taken to Creighton University Medical Center-Bergan Mercy after the Friday crash. Steiner's organs will be donated, said Tammy Trahan, her mother.",https://www.omaha.com/news/metro/a-ray-of-sunshine-family-devastated-by-freak-crash-involving/article_b1212644-0f56-5e07-8c14-0787fec6fa5a.html,2018-09-10T18:59:00Z
